"Status","Start Time","Stop Time","Duration in ms","Parent Suite","Suite","Sub Suite","Test Class","Test Method","Name","Description"
"passed","Wed Feb 05 13:27:43 GMT 2025","Wed Feb 05 13:27:43 GMT 2025","126","","pl.allegro.tech.hermes.integrationtests.management.TopicManagementTest","","pl.allegro.tech.hermes.integrationtests.management.TopicManagementTest","shouldAllowAdminUserCreateTopicWithNonDefaultFallbackToRemoteDatacenterEnabled","shouldAllowAdminUserCreateTopicWithNonDefaultFallbackToRemoteDatacenterEnabled()",""
"passed","Wed Feb 05 13:25:16 GMT 2025","Wed Feb 05 13:25:16 GMT 2025","7","","DirectCompiledSchemaRepositoryTest","","pl.allegro.tech.hermes.schema.DirectCompiledSchemaRepositoryTest","should fail to provide schema if loading schema source failed","should fail to provide schema if loading schema source failed",""
"passed","Wed Feb 05 13:19:55 GMT 2025","Wed Feb 05 13:19:55 GMT 2025","8","","JsonToAvroMigrationKafkaNamesMapperTest","","pl.allegro.tech.hermes.common.kafka.JsonToAvroMigrationKafkaNamesMapperTest","should map subscription name 'group.topic$subscription' to consumer group 'ns_group_topic_subscription' for namespace 'ns'","should map subscription name 'group.topic$subscription' to consumer group 'ns_group_topic_subscription' for namespace 'ns'",""
"passed","Wed Feb 05 13:20:48 GMT 2025","Wed Feb 05 13:20:49 GMT 2025","934","","pl.allegro.tech.hermes.integrationtests.BatchDeliveryTest","","pl.allegro.tech.hermes.integrationtests.BatchDeliveryTest","shouldDeliverBatchInGivenTimePeriod","shouldDeliverBatchInGivenTimePeriod()",""
"passed","Wed Feb 05 13:19:13 GMT 2025","Wed Feb 05 13:19:13 GMT 2025","201","ServiceResponseMetrics","","","","","should render service response metrics card",""
"passed","Wed Feb 05 13:18:22 GMT 2025","Wed Feb 05 13:18:22 GMT 2025","68","GroupTopicsView","","","","","should hide loading spinner when data fetch is complete",""
"passed","Wed Feb 05 13:19:59 GMT 2025","Wed Feb 05 13:19:59 GMT 2025","8","","AvroPathMessageFilterSpec","","pl.allegro.tech.hermes.domain.filtering.AvroPathMessageFilterSpec","array paths [path: .cast[*].lastName, matcher: Pacino, matchingStrategy: null, result: false, #0]","array paths [path: .cast[*].lastName, matcher: Pacino, matchingStrategy: null, result: false, #0]",""
"passed","Wed Feb 05 13:23:16 GMT 2025","Wed Feb 05 13:23:16 GMT 2025","2","","TopicValidatorTest","","pl.allegro.tech.hermes.management.domain.topic.validator.TopicValidatorTest","topic when doing a basic update should be valid","topic when doing a basic update should be valid",""
"passed","Wed Feb 05 13:18:40 GMT 2025","Wed Feb 05 13:18:40 GMT 2025","90","EnvironmentSwitch","","","","","should open the new tab on holding ctrl and clicking",""
"passed","Wed Feb 05 13:24:41 GMT 2025","Wed Feb 05 13:24:41 GMT 2025","2","","JsonQueryParserTest","","pl.allegro.tech.hermes.management.infrastructure.query.parser.json.JsonQueryParserTest","should fail to parse and query","should fail to parse and query",""
"passed","Wed Feb 05 13:18:47 GMT 2025","Wed Feb 05 13:18:47 GMT 2025","87","useRoles","","","","","should fetch user roles from Hermes API without topic and subscription",""
"passed","Wed Feb 05 13:20:27 GMT 2025","Wed Feb 05 13:20:27 GMT 2025","4","","HermesHeadersProviderTest","","pl.allegro.tech.hermes.consumers.consumer.sender.http.headers.HermesHeadersProviderTest","should forward headers from nested provider","should forward headers from nested provider",""
"passed","Wed Feb 05 13:23:06 GMT 2025","Wed Feb 05 13:23:07 GMT 2025","801","","pl.allegro.tech.hermes.integrationtests.MetricsTest","","pl.allegro.tech.hermes.integrationtests.MetricsTest","shouldReportHttpErrorCodeMetrics","shouldReportHttpErrorCodeMetrics()",""
"passed","Wed Feb 05 13:20:10 GMT 2025","Wed Feb 05 13:20:10 GMT 2025","0","","pl.allegro.tech.hermes.common.message.wrapper.SchemaAwareSerDeTest","","pl.allegro.tech.hermes.common.message.wrapper.SchemaAwareSerDeTest","shouldThrowExceptionWhenDeserializingWithoutMagicByte","shouldThrowExceptionWhenDeserializingWithoutMagicByte",""
"passed","Wed Feb 05 13:19:10 GMT 2025","Wed Feb 05 13:19:10 GMT 2025","202","FiltersCard","","","","","should render a card",""
"passed","Wed Feb 05 13:20:20 GMT 2025","Wed Feb 05 13:20:20 GMT 2025","113","","JsonMessageBatchTest","","pl.allegro.tech.hermes.consumers.consumer.batch.JsonMessageBatchTest","should append data into buffer [data: [xx], capacity: 4, #0]","should append data into buffer [data: [xx], capacity: 4, #0]",""
"passed","Wed Feb 05 13:19:15 GMT 2025","Wed Feb 05 13:19:15 GMT 2025","221","ConsumerGroupsTable","","","","","should render consumerGroups table",""
"passed","Wed Feb 05 13:25:01 GMT 2025","Wed Feb 05 13:25:03 GMT 2025","1757","","pl.allegro.tech.hermes.integrationtests.RemoteDatacenterProduceFallbackTest","","pl.allegro.tech.hermes.integrationtests.RemoteDatacenterProduceFallbackTest","shouldReturn500whenBothDCsAreUnavailable","shouldReturn500whenBothDCsAreUnavailable()",""
"passed","Wed Feb 05 13:18:50 GMT 2025","Wed Feb 05 13:18:51 GMT 2025","60","useSearch","","","","","should retrieve subscription query results from Hermes API",""
"passed","Wed Feb 05 13:19:59 GMT 2025","Wed Feb 05 13:19:59 GMT 2025","8","","AvroPathMessageFilterSpec","","pl.allegro.tech.hermes.domain.filtering.AvroPathMessageFilterSpec","basic paths [path: .batter.id, matcher: 1004, result: false, #7]","basic paths [path: .batter.id, matcher: 1004, result: false, #7]",""
"passed","Wed Feb 05 13:26:11 GMT 2025","Wed Feb 05 13:26:15 GMT 2025","4238","","pl.allegro.tech.hermes.integrationtests.management.QueryEndpointTest","","pl.allegro.tech.hermes.integrationtests.management.QueryEndpointTest","shouldHandleUnavailableSubscriptionsMetrics","shouldHandleUnavailableSubscriptionsMetrics()",""
"passed","Wed Feb 05 13:18:49 GMT 2025","Wed Feb 05 13:18:49 GMT 2025","76","StatsView","","","","","should show error message when fetching data failed",""
"passed","Wed Feb 05 13:19:49 GMT 2025","Wed Feb 05 13:19:49 GMT 2025","11","","ReactiveHermesSenderTest","","pl.allegro.tech.hermes.client.ReactiveHermesSenderTest","should read header Hermes-Message-Id being case insensitive when publishing using WebClientSender sender","should read header Hermes-Message-Id being case insensitive when publishing using WebClientSender sender",""
"passed","Wed Feb 05 13:20:19 GMT 2025","Wed Feb 05 13:20:20 GMT 2025","220","","ResilientMessageSenderTest","","pl.allegro.tech.hermes.consumers.consumer.ResilientMessageSenderTest","should asynchronously time out send future and report failed sending","should asynchronously time out send future and report failed sending",""
"passed","Wed Feb 05 13:18:59 GMT 2025","Wed Feb 05 13:18:59 GMT 2025","47","HomeView","","","","","should render proper buttons",""
"passed","Wed Feb 05 13:20:29 GMT 2025","Wed Feb 05 13:20:29 GMT 2025","3","","SignalsFilterTest","","pl.allegro.tech.hermes.consumers.supervisor.process.SignalsFilterTest","should filter out contradicting signals like START & STOP or STOP & START for the same subscription","should filter out contradicting signals like START & STOP or STOP & START for the same subscription",""
"passed","Wed Feb 05 13:18:18 GMT 2025","Wed Feb 05 13:18:18 GMT 2025","19","useConstraints","","","","","should dispatch notification on successful subscription constraint delete",""
"passed","Wed Feb 05 13:18:12 GMT 2025","Wed Feb 05 13:18:12 GMT 2025","157","PropertiesCard","","","","","should render subscription batch size for BATCH delivery type",""
"passed","Wed Feb 05 13:23:16 GMT 2025","Wed Feb 05 13:23:16 GMT 2025","3","","InflightSizeValidatorTest","","pl.allegro.tech.hermes.management.domain.subscription.validator.InflightSizeValidatorTest","changing inflight should not be allowed for users [previousInflight: null, updatedInflight: 60, message: Inflight size can't be changed by non admin users. Changed from: null, to: 60, #0]","changing inflight should not be allowed for users [previousInflight: null, updatedInflight: 60, message: Inflight size can't be changed by non admin users. Changed from: null, to: 60, #0]",""
"passed","Wed Feb 05 13:24:29 GMT 2025","Wed Feb 05 13:24:30 GMT 2025","1024","","KafkaConsumerGroupManagerSpec","","pl.allegro.tech.hermes.management.infrastructure.kafka.service.KafkaConsumerGroupManagerSpec","should create consumer group with offset equal to last topic offset","should create consumer group with offset equal to last topic offset",""
"passed","Wed Feb 05 13:24:23 GMT 2025","Wed Feb 05 13:24:24 GMT 2025","900","","pl.allegro.tech.hermes.integrationtests.PublishingAvroTest","","pl.allegro.tech.hermes.integrationtests.PublishingAvroTest","shouldUseExplicitSchemaVersionWhenPublishingAndConsuming","shouldUseExplicitSchemaVersionWhenPublishingAndConsuming()",""
"passed","Wed Feb 05 13:18:35 GMT 2025","Wed Feb 05 13:18:35 GMT 2025","1","useConsistencyStore","","","","","should filter groups",""
"passed","Wed Feb 05 13:20:39 GMT 2025","Wed Feb 05 13:20:40 GMT 2025","717","","pl.allegro.tech.hermes.integrationtests.BasicAuthSubscribingTest","","pl.allegro.tech.hermes.integrationtests.BasicAuthSubscribingTest","shouldUpdateSubscriptionUsernameAndPassword","shouldUpdateSubscriptionUsernameAndPassword()",""
"passed","Wed Feb 05 13:21:20 GMT 2025","Wed Feb 05 13:21:24 GMT 2025","4753","","LocalDatacenterMessageProducerIntegrationTest","","pl.allegro.tech.hermes.frontend.producer.kafka.LocalDatacenterMessageProducerIntegrationTest","should publish messages on only one partition for the same partition-key","should publish messages on only one partition for the same partition-key",""
"passed","Wed Feb 05 13:18:24 GMT 2025","Wed Feb 05 13:18:24 GMT 2025","89","MetricsCard","","","","","should render subscription codes4xx",""
"passed","Wed Feb 05 13:20:35 GMT 2025","Wed Feb 05 13:20:37 GMT 2025","1413","","pl.allegro.tech.hermes.consumers.consumer.ConsumerMessageSenderTest","","pl.allegro.tech.hermes.consumers.consumer.ConsumerMessageSenderTest","shouldIncreaseRetryBackoffExponentially","shouldIncreaseRetryBackoffExponentially",""
"passed","Wed Feb 05 13:23:13 GMT 2025","Wed Feb 05 13:23:13 GMT 2025","1","","SubscriptionHealthCheckerTest","","pl.allegro.tech.hermes.management.domain.subscription.SubscriptionHealthCheckerTest","should not indicate that a serial subscriber without retry returning more than 10% 4xx errors is receiving malformed events","should not indicate that a serial subscriber without retry returning more than 10% 4xx errors is receiving malformed events",""
"passed","Wed Feb 05 13:18:58 GMT 2025","Wed Feb 05 13:18:58 GMT 2025","62","useConsumerGroups","","","","","should set error to true on consumerGroups endpoint failure",""
"passed","Wed Feb 05 13:19:37 GMT 2025","Wed Feb 05 13:19:37 GMT 2025","4","","OAuthProviderTest","","pl.allegro.tech.hermes.api.OAuthProviderTest","should deserialize provider with previously missing socket timeout","should deserialize provider with previously missing socket timeout",""
"passed","Wed Feb 05 13:19:45 GMT 2025","Wed Feb 05 13:19:45 GMT 2025","5","","HermesClientTest","","pl.allegro.tech.hermes.client.HermesClientTest","should retry on http failure [status: 500, #1]","should retry on http failure [status: 500, #1]",""
"passed","Wed Feb 05 13:23:16 GMT 2025","Wed Feb 05 13:23:16 GMT 2025","1","","InflightSizeValidatorTest","","pl.allegro.tech.hermes.management.domain.subscription.validator.InflightSizeValidatorTest","changing inflight should be allowed for admins [previousInflight: 60, updatedInflight: 120, #2]","changing inflight should be allowed for admins [previousInflight: 60, updatedInflight: 120, #2]",""
"passed","Wed Feb 05 13:25:04 GMT 2025","Wed Feb 05 13:25:05 GMT 2025","893","","pl.allegro.tech.hermes.integrationtests.RemoteDatacenterProduceFallbackTest","","pl.allegro.tech.hermes.integrationtests.RemoteDatacenterProduceFallbackTest","shouldReturnErrorWhenChaosExperimentIsEnabledForAllDatacenters","shouldReturnErrorWhenChaosExperimentIsEnabledForAllDatacenters()",""
"passed","Wed Feb 05 13:18:15 GMT 2025","Wed Feb 05 13:18:15 GMT 2025","428","SubscriptionView","","","","","should show confirmation dialog on activate button click",""
"passed","Wed Feb 05 13:24:29 GMT 2025","Wed Feb 05 13:24:29 GMT 2025","246","","pl.allegro.tech.hermes.integrationtests.PublishingTest","","pl.allegro.tech.hermes.integrationtests.PublishingTest","shouldReturn4xxForTooLargeContent","shouldReturn4xxForTooLargeContent()",""
"passed","Wed Feb 05 13:23:12 GMT 2025","Wed Feb 05 13:23:12 GMT 2025","334","MultiZookeeperIntegrationTest","HealthCheckTaskTest","","pl.allegro.tech.hermes.management.domain.health.HealthCheckTaskTest","should not change status to READ_WRITE if READ_ONLY is set by admin","should not change status to READ_WRITE if READ_ONLY is set by admin",""
"passed","Wed Feb 05 13:18:31 GMT 2025","Wed Feb 05 13:18:31 GMT 2025","17","useGroups","","","","","should dispatch notification on successful group create",""
"passed","Wed Feb 05 13:19:45 GMT 2025","Wed Feb 05 13:19:45 GMT 2025","5","","HermesClientTest","","pl.allegro.tech.hermes.client.HermesClientTest","should retry on http failure [status: 502, #3]","should retry on http failure [status: 502, #3]",""
"passed","Wed Feb 05 13:19:38 GMT 2025","Wed Feb 05 13:19:38 GMT 2025","9","","SubscriptionConstraintsValidationTest","","pl.allegro.tech.hermes.api.SubscriptionConstraintsValidationTest","there shouldn't be any violations for valid inputs [consumersNumber: 100, reason: r, #3]","there shouldn't be any violations for valid inputs [consumersNumber: 100, reason: r, #3]",""
"passed","Wed Feb 05 13:26:26 GMT 2025","Wed Feb 05 13:26:30 GMT 2025","4008","","pl.allegro.tech.hermes.integrationtests.management.QueryEndpointTest","","pl.allegro.tech.hermes.integrationtests.management.QueryEndpointTest","shouldQuerySubscription","shouldQuerySubscription(String, List) [3] {""query"": {""name"": {""like"": "".*cription1""}}}, [1]",""
"passed","Wed Feb 05 13:18:53 GMT 2025","Wed Feb 05 13:18:53 GMT 2025","45","useOfflineRetransmission","","","","","should dispatch notification on successful task create",""
"passed","Wed Feb 05 13:20:23 GMT 2025","Wed Feb 05 13:20:23 GMT 2025","1","","GooglePubSubSenderTargetResolverTest","","pl.allegro.tech.hermes.consumers.consumer.sender.googlepubsub.GooglePubSubSenderTargetResolverTest","should resolve endpoint address [endpointAddressUri: googlepubsub://pubsub.googleapis.com:443/projects/test-project/topics/test-topic?compression, expectedCodec: EMPTY, #2]","should resolve endpoint address [endpointAddressUri: googlepubsub://pubsub.googleapis.com:443/projects/test-project/topics/test-topic?compression, expectedCodec: EMPTY, #2]",""
"passed","Wed Feb 05 13:20:23 GMT 2025","Wed Feb 05 13:20:23 GMT 2025","1","","GooglePubSubMessageTransformerCompressionTest","","pl.allegro.tech.hermes.consumers.consumer.sender.googlepubsub.GooglePubSubMessageTransformerCompressionTest","should compress or not according to message size [compressionThresholdBytes: 1000, shouldCompress: false, #1]","should compress or not according to message size [compressionThresholdBytes: 1000, shouldCompress: false, #1]",""
"passed","Wed Feb 05 13:18:15 GMT 2025","Wed Feb 05 13:18:15 GMT 2025","126","PropertiesCard","","","","","should render subscription modification date",""
"passed","Wed Feb 05 13:19:03 GMT 2025","Wed Feb 05 13:19:03 GMT 2025","54","InconsistentGroupListing","","","","","should render empty groups table",""
"passed","Wed Feb 05 13:22:47 GMT 2025","Wed Feb 05 13:22:47 GMT 2025","7","","MultiDatacenterRepositoryCommandExecutorTest","","pl.allegro.tech.hermes.management.domain.dc.MultiDatacenterRepositoryCommandExecutorTest","should not rollback and should fail when executing user is admin and mode is read only and general fail occurs","should not rollback and should fail when executing user is admin and mode is read only and general fail occurs",""
"passed","Wed Feb 05 13:18:10 GMT 2025","Wed Feb 05 13:18:10 GMT 2025","60","useSubscription","","","","","should set last undelivered message to `null` on backend HTTP 404",""
"passed","Wed Feb 05 13:19:40 GMT 2025","Wed Feb 05 13:19:40 GMT 2025","0","","pl.allegro.tech.hermes.api.TopicNameTest","","pl.allegro.tech.hermes.api.TopicNameTest","shouldConvertQualifiedName","shouldConvertQualifiedName",""
"passed","Wed Feb 05 13:23:17 GMT 2025","Wed Feb 05 13:23:17 GMT 2025","13","","TopicValidatorWithRealApiPreconditionsTest","","pl.allegro.tech.hermes.management.domain.topic.validator.TopicValidatorWithRealApiPreconditionsTest","updating topic with up to 7 days of retention time should be valid [retentionTime: <pl.allegro.tech.hermes.api.RetentionTime@20 duration=1 retentionUnit=DAYS>, user: <pl.allegro.tech.hermes.management.domain.auth.TestRequestUser@6e5d37c0 username=regularUser admin=false isOwner=false>, #9]","updating topic with up to 7 days of retention time should be valid [retentionTime: <pl.allegro.tech.hermes.api.RetentionTime@20 duration=1 retentionUnit=DAYS>, user: <pl.allegro.tech.hermes.management.domain.auth.TestRequestUser@6e5d37c0 username=regularUser admin=false isOwner=false>, #9]",""
"passed","Wed Feb 05 13:25:11 GMT 2025","Wed Feb 05 13:25:11 GMT 2025","24","","HermesMockTest","","pl.allegro.tech.hermes.mock.HermesMockTest","should get all messages as specified class","should get all messages as specified class",""
"passed","Wed Feb 05 13:18:37 GMT 2025","Wed Feb 05 13:18:37 GMT 2025","71","ConsoleHeader","","","","","should display login button",""
"passed","Wed Feb 05 13:24:37 GMT 2025","Wed Feb 05 13:24:37 GMT 2025","2","","CachingPrometheusClientTest","","pl.allegro.tech.hermes.management.infrastructure.prometheus.CachingPrometheusClientTest","should get metrics from the underlying client after TTL expires","should get metrics from the underlying client after TTL expires",""
"passed","Wed Feb 05 13:20:23 GMT 2025","Wed Feb 05 13:20:23 GMT 2025","1","","HttpAuthorizationProviderFactoryTest","","pl.allegro.tech.hermes.consumers.consumer.sender.http.HttpAuthorizationProviderFactoryTest","should return empty when URL has no credentials","should return empty when URL has no credentials",""
"passed","Wed Feb 05 13:24:41 GMT 2025","Wed Feb 05 13:24:41 GMT 2025","4","","JsonQueryParserTest","","pl.allegro.tech.hermes.management.infrastructure.query.parser.json.JsonQueryParserTest","should parse query with in operator and match multiple results","should parse query with in operator and match multiple results",""
"passed","Wed Feb 05 13:27:37 GMT 2025","Wed Feb 05 13:27:37 GMT 2025","235","","pl.allegro.tech.hermes.integrationtests.management.SubscriptionManagementTest","","pl.allegro.tech.hermes.integrationtests.management.SubscriptionManagementTest","shouldRespectPrivilegedSubscriberProtocolsWhileCreatingSubscription","shouldRespectPrivilegedSubscriberProtocolsWhileCreatingSubscription()",""
"passed","Wed Feb 05 13:22:33 GMT 2025","Wed Feb 05 13:22:33 GMT 2025","3","","pl.allegro.tech.hermes.frontend.publishing.message.MessageContentTypeEnforcerTest","","pl.allegro.tech.hermes.frontend.publishing.message.MessageContentTypeEnforcerTest","shouldNotConvertWhenReceivingAvroOnAvroTopic","shouldNotConvertWhenReceivingAvroOnAvroTopic",""
"passed","Wed Feb 05 13:19:40 GMT 2025","Wed Feb 05 13:19:40 GMT 2025","4","","EndpointAddressSerializationTest","","pl.allegro.tech.hermes.api.jackson.EndpointAddressSerializationTest","should serialize endpoint address to string","should serialize endpoint address to string",""
"passed","Wed Feb 05 13:22:47 GMT 2025","Wed Feb 05 13:22:47 GMT 2025","2","","InactiveTopicsDetectionServiceTest","","pl.allegro.tech.hermes.management.domain.detection.InactiveTopicsDetectionServiceTest","should be notified when inactive and enough time from last notification [now: 2021-09-23T16:31:06.987Z, notificationTimestamps: [2021-09-09T16:31:06.987Z], #0]","should be notified when inactive and enough time from last notification [now: 2021-09-23T16:31:06.987Z, notificationTimestamps: [2021-09-09T16:31:06.987Z], #0]",""
"passed","Wed Feb 05 13:25:37 GMT 2025","Wed Feb 05 13:25:39 GMT 2025","2004","","pl.allegro.tech.hermes.integrationtests.management.ListUnhealthySubscriptionsForOwnerTest","","pl.allegro.tech.hermes.integrationtests.management.ListUnhealthySubscriptionsForOwnerTest","shouldReportAllUnhealthySubscriptions","shouldReportAllUnhealthySubscriptions()",""
"passed","Wed Feb 05 13:23:12 GMT 2025","Wed Feb 05 13:23:13 GMT 2025","1741","","pl.allegro.tech.hermes.integrationtests.MetricsTest","","pl.allegro.tech.hermes.integrationtests.MetricsTest","shouldReportMetricForFilteredSubscription","shouldReportMetricForFilteredSubscription()",""
"passed","Wed Feb 05 13:27:29 GMT 2025","Wed Feb 05 13:27:30 GMT 2025","771","","pl.allegro.tech.hermes.integrationtests.management.SubscriptionManagementTest","","pl.allegro.tech.hermes.integrationtests.management.SubscriptionManagementTest","shouldSetInflightSizeToNullByDefault","shouldSetInflightSizeToNullByDefault()",""
"passed","Wed Feb 05 13:23:17 GMT 2025","Wed Feb 05 13:23:17 GMT 2025","14","","TopicValidatorWithRealApiPreconditionsTest","","pl.allegro.tech.hermes.management.domain.topic.validator.TopicValidatorWithRealApiPreconditionsTest","updating topic without modifying retention time already exceeding maximum should be valid [user: <pl.allegro.tech.hermes.management.domain.auth.TestRequestUser@6e5d37c0 username=regularUser admin=false isOwner=false>, #0]","updating topic without modifying retention time already exceeding maximum should be valid [user: <pl.allegro.tech.hermes.management.domain.auth.TestRequestUser@6e5d37c0 username=regularUser admin=false isOwner=false>, #0]",""
"passed","Wed Feb 05 13:23:16 GMT 2025","Wed Feb 05 13:23:16 GMT 2025","0","","ContentTypeValidatorSpec","","pl.allegro.tech.hermes.management.domain.topic.validator.ContentTypeValidatorSpec","content type JSON in whitelist [AVRO, JSON] should be valid","content type JSON in whitelist [AVRO, JSON] should be valid",""
"passed","Wed Feb 05 13:19:38 GMT 2025","Wed Feb 05 13:19:38 GMT 2025","6","","SubscriptionConstraintsValidationTest","","pl.allegro.tech.hermes.api.SubscriptionConstraintsValidationTest","there shouldn't be any violations for valid inputs [consumersNumber: 100, reason: null, #2]","there shouldn't be any violations for valid inputs [consumersNumber: 100, reason: null, #2]",""
"passed","Wed Feb 05 13:23:16 GMT 2025","Wed Feb 05 13:23:16 GMT 2025","2","","InflightSizeValidatorTest","","pl.allegro.tech.hermes.management.domain.subscription.validator.InflightSizeValidatorTest","changing inflight should be allowed for admins [previousInflight: 60, updatedInflight: null, #1]","changing inflight should be allowed for admins [previousInflight: 60, updatedInflight: null, #1]",""
"passed","Wed Feb 05 13:20:44 GMT 2025","Wed Feb 05 13:20:44 GMT 2025","2","","pl.allegro.tech.hermes.consumers.consumer.sender.jms.JmsMessageSenderTest","","pl.allegro.tech.hermes.consumers.consumer.sender.jms.JmsMessageSenderTest","shouldReturnFalseWhenJMSThrowsRuntimeException","shouldReturnFalseWhenJMSThrowsRuntimeException",""
"passed","Wed Feb 05 13:22:44 GMT 2025","Wed Feb 05 13:22:45 GMT 2025","327","MultiZookeeperIntegrationTest","StorageSyncSpec","","pl.allegro.tech.hermes.management.domain.consistency.StorageSyncSpec","should create subscription in all DCs if primary datacenter contains subscription","should create subscription in all DCs if primary datacenter contains subscription",""
"passed","Wed Feb 05 13:24:53 GMT 2025","Wed Feb 05 13:24:53 GMT 2025","5","","pl.allegro.tech.hermes.integrationtests.TopicBlacklistTest","","pl.allegro.tech.hermes.integrationtests.TopicBlacklistTest","shouldBlacklistNonExistingTopic","shouldBlacklistNonExistingTopic()",""
"passed","Wed Feb 05 13:20:35 GMT 2025","Wed Feb 05 13:20:35 GMT 2025","598","","pl.allegro.tech.hermes.integrationtests.HermesClientPublishingHttpsTest","","pl.allegro.tech.hermes.integrationtests.HermesClientPublishingHttpsTest","shouldCommunicateWithHermesUsingHttp2","shouldCommunicateWithHermesUsingHttp2()",""
"passed","Wed Feb 05 13:19:49 GMT 2025","Wed Feb 05 13:19:49 GMT 2025","12","","HermesSenderTest","","pl.allegro.tech.hermes.client.HermesSenderTest","should read header hermes-message-id being case insensitive when publishing using WebClientSender sender","should read header hermes-message-id being case insensitive when publishing using WebClientSender sender",""
"passed","Wed Feb 05 13:19:45 GMT 2025","Wed Feb 05 13:19:45 GMT 2025","2","","HermesClientTest","","pl.allegro.tech.hermes.client.HermesClientTest","should retry on http failure [status: 501, #2]","should retry on http failure [status: 501, #2]",""
"passed","Wed Feb 05 13:19:59 GMT 2025","Wed Feb 05 13:19:59 GMT 2025","8","","AggregatingTurboFilterTest","","pl.allegro.tech.hermes.infrastructure.logback.AggregatingTurboFilterTest","should not report when there are no more logs","should not report when there are no more logs",""
"passed","Wed Feb 05 13:20:11 GMT 2025","Wed Feb 05 13:20:11 GMT 2025","3","","pl.allegro.tech.hermes.common.metric.counter.zookeeper.ZookeeperCounterStorageTest","","pl.allegro.tech.hermes.common.metric.counter.zookeeper.ZookeeperCounterStorageTest","shouldReadValueFromSubscriptionMetric","shouldReadValueFromSubscriptionMetric",""
"passed","Wed Feb 05 13:20:02 GMT 2025","Wed Feb 05 13:20:03 GMT 2025","117","IntegrationTest","ZookeeperOAuthProviderRepositoryTest","","pl.allegro.tech.hermes.infrastructure.zookeeper.ZookeeperOAuthProviderRepositoryTest","should remove oauth provider","should remove oauth provider",""
"passed","Wed Feb 05 13:22:40 GMT 2025","Wed Feb 05 13:22:40 GMT 2025","14","","DcConsistencyServiceSpec","","pl.allegro.tech.hermes.management.domain.consistency.DcConsistencyServiceSpec","should report storage as consistent with periodic check","should report storage as consistent with periodic check",""
